"externalId"||`||"classificationOfInstructionalProgramCode"||`||"courseNumber"||`||"courseTitle"||`||"departmentExternalId"||`||"institutionExternalId"||`||"facilityExternalId"||`||"description"
"CSCI195  HM"||`||""||`||"CSCI195  HM"||`||"Computer Science Colloquium"||`||"HCSI"||`||"HM"||`||"HM"||`||"Oral presentations and discussions of selected topics, including recent developments in computer science. Participants include computer science majors, Clinic participants, faculty members and visiting speakers. Required for all junior and senior computer science majors. No more than 2.0 units of credit can be earned for colloquia. Pass/No Credit grading. Juniors and seniors only. "
"CSMT181A JT"||`||""||`||"CSMT181A JT"||`||"Discrete Differential Geometry"||`||"HCSM"||`||"HM"||`||"HM"||`||"In this course, students will explore how fundamental geometric concepts, such as curvature, can be understood from complementary computational and mathematical points of view. This dual perspective enriches understanding on both sides, and informs the development of practical algorithms for working with real-world geometric data. Along the way, we will revisit important ideas from calculus and linear algebra, emphasizing a visual understanding that complements the more traditional algebraic treatment. The course provides essential mathematical background along with real-world examples and applications. It also provides a short survey of recent developments in digital geometry processing and discrete differential geometry. Topics include: curves and surfaces, curvature, connections and parallel transport, exterior algebra, exterior calculus, Stokes theorem, simplicial homology, de Rham cohomology, Helmholtz-Hodge decomposition, conformal mapping, finite element methods, and numerical linear algebra. Applications include: approximation of curvature, curve and surface smoothing, surface parameterization, vector field design, and the computation of geodesic distance. Prerequisites: (CSCI042  HM or CSCI060  HM or (CSCI052  PO and CSCI062  HM)) and (completed HMC math Core or (MATH032 (calc III) and MATH060 (linear algebra)))"
"CSMT184  HM"||`||""||`||"CSMT184  HM"||`||"Computer Science&Math Clinic II"||`||"HCSM"||`||"HM"||`||"HM"||`||"Team project in joint computer science and mathematics, with corporate affiliation. 183 and 184 must be taken consecutively to count toward the major. Prerequisite: CSMT183  HM. "
"DANC010  PO"||`||""||`||"DANC010  PO"||`||"Beginning Modern Dance"||`||"PTHD"||`||"PO"||`||"PO"||`||"Beginning Modern Dance. Introductory dance technique class exploring principles of modern, ballet and jazz techniques, body alignment and elementary composition and improvisation. Discussion of how the study of human movement relates to other disciplines. May be taken two times for credit."
"DANC012  PO"||`||""||`||"DANC012  PO"||`||"Beginning Ballet I"||`||"PTHD"||`||"PO"||`||"PO"||`||"Beginning Ballet. Introductory class stressing the fundamentals of classical ballet. Students learn basic dance vocabulary at the barre and in the center and to develop coordination, musicality, alignment and harmony of line. Critical reviews in addition to studio work. Half-course. Also available as studio course for cumulative credit (12P). May be taken four times for credit."
"DANC012 PPO"||`||""||`||"DANC012 PPO"||`||"Beginning Ballet I"||`||"PTHD"||`||"PO"||`||"PO"||`||"Beginning Ballet. Introductory class stressing the fundamentals of classical ballet. Students learn basic dance vocabulary at the barre and in the center and to develop coordination, musicality, alignment and harmony of line. Critical reviews in addition to studio work. Half-course. Also available as studio course for cumulative credit (12P). May be taken four times for credit."
"DANC050  PO"||`||""||`||"DANC050  PO"||`||"Intermediate Modern Dance"||`||"PTHD"||`||"PO"||`||"PO"||`||"Intermediate Modern Technique. Exploration of modern dance technique and introduction to style work. Principles of fall and recovery; isolations of the body, weight and suspension; and special attention to body alignment, dynamics and musical phrasing. Critical reviews in addition to studio work. Half-course. Also available as studio course for cumulative credit (50P). Prerequisite: previous dance training. May be taken four times for credit."
"DANC050 PPO"||`||""||`||"DANC050 PPO"||`||"Intermediate Modern Dance"||`||"PTHD"||`||"PO"||`||"PO"||`||"Intermediate Modern Technique. Exploration of modern dance technique and introduction to style work. Principles of fall and recovery; isolations of the body, weight and suspension; and special attention to body alignment, dynamics and musical phrasing. Critical reviews in addition to studio work. Half-course. Also available as studio course for cumulative credit (50P). Prerequisite: previous dance training. May be taken four times for credit."
"DANC051  PO"||`||""||`||"DANC051  PO"||`||"Intermediate Ballet Technique"||`||"PTHD"||`||"PO"||`||"PO"||`||"Intermediate Ballet. Intermediate class expanding basic dance vocabulary of Ballet I.  Barre and center floor work with attention to alignment, musical phrasing, dynamics, harmony of line and ease of movement. Critical reviews in addition to studio work. Half-course. Also available as studio course for cumulative credit (51P). Prerequisite: previous dance training. May be taken four times for credit."
"DANC051 PPO"||`||""||`||"DANC051 PPO"||`||"Intermediate Ballet Technique"||`||"PTHD"||`||"PO"||`||"PO"||`||"Intermediate Ballet. Intermediate class expanding basic dance vocabulary of Ballet I.  Barre and center floor work with attention to alignment, musical phrasing, dynamics, harmony of line and ease of movement. Critical reviews in addition to studio work. Half-course. Also available as studio course for cumulative credit (51P). Prerequisite: previous dance training. May be taken four times for credit."
"DANC068  SC"||`||""||`||"DANC068  SC"||`||"Intro to Dance/Dance Studies"||`||"SDAN"||`||"SC"||`||"SC"||`||"Recommended for those students with no previous dance experience. Prepares the student for further study of particular dance styles such as modern, ballet, and jazz. Readings and written assignments augment studio experiences. May be taken twice for credit."
"DANC076A SC"||`||"50.0301"||`||"DANC076A SC"||`||"Modern Dance I"||`||"SDAN"||`||"SC"||`||"SC"||`||"Fundamentals of modern dance for the beginning student, including technique, improvisation, and composition. Some previous dance or movement experience recommended.  Readings and written assignments augment studio experiences. Full course. "
"DANC076B SC"||`||"50.0301"||`||"DANC076B SC"||`||"Modern Dance I"||`||"SDAN"||`||"SC"||`||"SC"||`||"Fundamentals of modern dance for the beginning student, including technique, improvisation, and composition. Some previous dance or movement experience recommended.  May be taken twice for credit. Half course. "
"DANC078A SC"||`||""||`||"DANC078A SC"||`||"Ballet I"||`||"SDAN"||`||"SC"||`||"SC"||`||"Fundamentals of ballet technique and theory. Includes barre, basic positions and center floor work. Some previous dance or movement experience recommended.  Includes readings, video viewings, and written/oral assignments in ballet history. Full course. "
"DANC078B SC"||`||""||`||"DANC078B SC"||`||"Ballet I"||`||"SDAN"||`||"SC"||`||"SC"||`||"Fundamentals of ballet technique and theory. Includes barre, basic positions and center floor work. Some previous dance or movement experience recommended. Half course. May be taken twice for credit. "
"DANC100A SC"||`||"50.0301"||`||"DANC100A SC"||`||"Modern Dance II"||`||"SDAN"||`||"SC"||`||"SC"||`||"Modern dance skills for the student with high intermediate competency. Emphasis on technique, with some improvisation and composition. Readings and written assignments augment studio experiences. Full course. "
"DANC100B SC"||`||"50.0301"||`||"DANC100B SC"||`||"Modern Dance II"||`||"SDAN"||`||"SC"||`||"SC"||`||"Modern dance skills for the student with high intermediate competency. Emphasis on technique, with some improvisation and composition. Half course. May be taken twice for credit. "
"DANC111B SC"||`||"50.0301"||`||"DANC111B SC"||`||"Adv Contemp Dance Practice"||`||"SDAN"||`||"SC"||`||"SC"||`||"Modern dance skills for the student with advanced competency. Emphasis on technique, with some improvisation and composition. Half course. May be taken twice for credit. Prerequisite: permission of instructor."
"DANC112A SC"||`||""||`||"DANC112A SC"||`||"Jazz Dance II"||`||"SDAN"||`||"SC"||`||"SC"||`||"Intermediate-level course will explore a variety of styles identified under the umbrella term Jazz, including twentieth century vernacular dances, swing, Broadway style, lyrical, modern jazz, and hip-hop. The class emphasizes rhythm, isolation, flow, syncopation, style, and performance quality. Readings, video viewings, and written assignments in historical, cultural, and aesthetic issues pertaining to jazz dance will augment studio experiences."
"DANC112B SC"||`||""||`||"DANC112B SC"||`||"Jazz Dance II"||`||"SDAN"||`||"SC"||`||"SC"||`||"Intermediate-level course will include a variety of styles from lyrical to hip-hop and street dance. Emphasis on rhythms, isolations, flow, syncopation, style, and performance quality. Half course, if 112A space permits; may be taken twice for credit."
"DANC120  PO"||`||""||`||"DANC120  PO"||`||"Modern Technique III"||`||"PTHD"||`||"PO"||`||"PO"||`||"Exploration of modern dance techniques with special attention to style, performance and principles of ensemble dancing. Introduction to 20th-21st century modern dance repertory. Previous dance training required. Half course. Also available as studio course for cumulative credit (DANC120 PPO)."
"DANC120 PPO"||`||""||`||"DANC120 PPO"||`||"Modern Technique III"||`||"PTHD"||`||"PO"||`||"PO"||`||"Advanced Modern Technique. Same course as 119 but studio work and critical reviews only. Half-course. Also available as studio course for cumulative credit (120P). May be repeated for credit.||``||||``||Spring 2015: Tsai is a break dancer and modern dance choreographer who combines fundamental floor work with elements of break dancing to create a new modern genre.||``||"
"DANC122  PO"||`||""||`||"DANC122  PO"||`||"Modern Technique IV"||`||"PTHD"||`||"PO"||`||"PO"||`||"Advanced Modern Technique. Same as 121 but studio work and critical reviews only. Half-course. Also available as studio course for cumulative credit (122P). May be repeated for credit."
"DANC122 PPO"||`||""||`||"DANC122 PPO"||`||"Modern Technique IV"||`||"PTHD"||`||"PO"||`||"PO"||`||"Advanced level modern technique study that prepares students for a variety of styles of performance repertory. Also available as a studio course for cumulative credit (DANC122 PPO)."
"DANC123  PO"||`||""||`||"DANC123  PO"||`||"Adv Ballet Technique & Theory"||`||"PTHD"||`||"PO"||`||"PO"||`||"Advanced Ballet Technique and Theory. Advanced class including barre and center with increasing stress on dynamics, musical phrasing and physical aplomb stripped of artifice. Classroom study supplemented by selected readings, critical reviews and written assignments. Prerequisite: permission of instructor. May be repeated for credit."
"DANC124  PO"||`||""||`||"DANC124  PO"||`||"Advanced Ballet Technique"||`||"PTHD"||`||"PO"||`||"PO"||`||"Advanced Ballet Technique. Same as 123 but studio work and critical reviews only. Half-course. Also available for cumulative credit (124P)."
"DANC124 PPO"||`||""||`||"DANC124 PPO"||`||"Advanced Ballet Technique"||`||"PTHD"||`||"PO"||`||"PO"||`||"Advanced Ballet Technique. Same as 123 but studio work and critical reviews only. Half-course. Also available for cumulative credit (124P)."
"DANC136B SC"||`||"50.0301"||`||"DANC136B SC"||`||"West African Dance II"||`||"SDAN"||`||"SC"||`||"SC"||`||"West African Dance II expands and builds upon the dance movement skills developed in Dance 135- Introduction to West African Dance.  The course is designed to strengthen and refine student knowledge and acquisition of complex West African dances and their rhythms.  Course objectives include student development of West African dance musicality and practice and rehearsal of West African dance techniques at performance level quality.  Study of historical and cultural context for the West African dances learned in the course will also be included. Prerequisite:  Previous African dance experience and permission of instructor."
"DANC138  PO"||`||""||`||"DANC138  PO"||`||"Concert Dance in the Global Age"||`||"PTHD"||`||"PO"||`||"PO"||`||"The 20th century witnessed an explosion in dance performances available to wider audiences than ever before in history. New forms emerged such as modern and postmodern dance, butoh, styles of professional folk dancing that first developed in Eastern Europe and classical Asian traditions that had never been presented outside of the courts in which they had developed. In addition, the 19th century saw the beginnings of Broadway musicals, and the 20th century the development of dance for the movies, and later television, which dramatically increased the demand for dance performances. The course will look at the ways these various professional dance genres have developed and the role they play in the concert scene today.||``||"
"DANC139  PO"||`||""||`||"DANC139  PO"||`||"Dance, Ethnicity, Nationalism"||`||"PTHD"||`||"PO"||`||"PO"||`||"In the United States, and generally in Western Europe, most individuals think of dance in three ways: 1.  A social activity such as a school dance or dancing in a club, 2. A form of entertainment as in a Broadway or Hollywood musical or a television program like 'Dancing with the Stars,' or 3. A form of artistic production like Giselle or choreography by Martha Graham. In this class we will look at dance in a different way. We will look at dance as a vehicle for achieving political goals, for representing the state, for building ethnic identities, for demonstrating national pride. We will first conceptualize the idea of dance as a political vehicle and then we will look at specific examples: Irish step dancing, Ukrainian and Russian folk dancing, the Hawaiian hula, the Argentine tango and Turkish folk dancing, among others, all of which have served regimes of various political stripes."
"DANC150A PO"||`||""||`||"DANC150A PO"||`||"Cultural Styles"||`||"PTHD"||`||"PO"||`||"PO"||`||"In-depth study of one cultural dance form or comparative study of two forms. May be repeated once for credit.||``||Fall 2015: Flamenco- History and practice of Flamenco, including its origins and current trends, brief history and explanation of Flamenco. Footwork and rhythms drills as well as hand and arm work."
"DANC150C PO"||`||""||`||"DANC150C PO"||`||"Music & Dance of Bali"||`||"PTHD"||`||"PO"||`||"PO"||`||"Music and Dance of Bali (online version). Exploration of Balinese dance traditions and online training in the movement language inherent in Balinese theatrical performance. Students enrolled in DANC 150C must be enrolled concurrently in MUS 041P: Balinese Gamelan Ensemble. Half-course. P/NP grading only."
"DANC151  PO"||`||""||`||"DANC151  PO"||`||"African Aesthetics"||`||"PTHD"||`||"PO"||`||"PO"||`||"Exploration of Cultural Styles: African Aesthetics. Studio half-course. May be repeated once for credit. Also available for cumulative credit (151P)."
"DANC151 PPO"||`||""||`||"DANC151 PPO"||`||"African Aesthetics"||`||"PTHD"||`||"PO"||`||"PO"||`||"Exploration of Cultural Styles:  African Aesthetics. May be repeated once for credit."
"DANC152  PO"||`||""||`||"DANC152  PO"||`||"Hip-Hop Dance"||`||"PTHD"||`||"PO"||`||"PO"||`||"Hip-Hop Dance. Studio course which focuses on the styles of hip-hop that have emerged since the 1970s.  Movement vocabulary and terminology specific to cities in which they originated; critical reviews. Also available for cumulative credit (152P).  Prerequisite: previous experience in hip-hop or other dance style, such as modern, jazz, or ballet."
"DANC152 PPO"||`||""||`||"DANC152 PPO"||`||"Hip-Hop Dance"||`||"PTHD"||`||"PO"||`||"PO"||`||""
"DANC160  SC"||`||""||`||"DANC160  SC"||`||"Dance Composition II"||`||"SDAN"||`||"SC"||`||"SC"||`||"Composition and improvisation skills with an emphasis on understanding form. Students must be concurrently participating in a dance movement class. Prerequisite: Composition I or permission of instructor."
"DANC162A SC"||`||"50.0301"||`||"DANC162A SC"||`||"Repertory"||`||"SDAN"||`||"SC"||`||"SC"||`||"Development of choreographic skill and/or performance quality and skill through choreographing or performing in dance faculty supervised productions. Does not meet fine arts breadth requirement. Full course, 2 or more dances, average of 8 hours of rehearsal per week.  May be taken twice for credit.  Eligibility by audition. Permission of instructor."
"DANC162B SC"||`||"50.0301"||`||"DANC162B SC"||`||"Repertory"||`||"SDAN"||`||"SC"||`||"SC"||`||"Development of choreographic skill and/or performance quality and skill through choreographing or performing in dance faculty supervised productions. Does not meet fine arts breadth requirement. Half course, one dance, average of 4 hours of rehearsal per week.  May be taken twice for credit.  Eligibility by audition. Permission of instructor. "
"DANC170  PO"||`||""||`||"DANC170  PO"||`||"The Mind in Motion"||`||"PTHD"||`||"PO"||`||"PO"||`||"Exploration of the interplay between sensory awareness and the organization of human movement. Basic anatomy/physiology of the senses, the development of awareness and related movement patterning from gestation through infancy and on into more complex patterns of learning and growth. With experiential movement lab.  "
"DANC175  PO"||`||""||`||"DANC175  PO"||`||"Alexander Technique - Group"||`||"PTHD"||`||"PO"||`||"PO"||`||"Theory and practice of Alexander Technique to improve efficiency and ease of movement in daily life, sports and the performing arts. Emphasis on coordination, expressivity and performance presence. Studio and research. Variants of this course are DANC176 PO, THEA53HGPO, and THEA053CGPO."
"DANC176  PO"||`||""||`||"DANC176  PO"||`||"Alexander Technique - Group"||`||"PTHD"||`||"PO"||`||"PO"||`||"Same as DANC175 PO, but offered as half-course."
"DANC180  PO"||`||""||`||"DANC180  PO"||`||"Dance Repertory"||`||"PTHD"||`||"PO"||`||"PO"||`||"Dance Repertory. Participation in two works by faculty, advanced students, guest artists or major choreographers. Students participate in the reconstruction of a previously choreographed work or contribute to the creation of a new work. Prerequisite: permission of instructor. May be repeated once for credit."
"DANC180 PPO"||`||""||`||"DANC180 PPO"||`||"Dance Repertory"||`||"PTHD"||`||"PO"||`||"PO"||`||"Dance Repertory.  Please note that DANC180 PPO is the cumulative (i.e. quarter credit) version of DANC180 PO.  See the listing for DANC180 PO for the complete description."
"DANC181  PO"||`||""||`||"DANC181  PO"||`||"Dance Repertory"||`||"PTHD"||`||"PO"||`||"PO"||`||"Dance Repertory. Same course as 180, but studio work and critical reviews only. Half-course. Also available as studio course for cumulative credit (181P)."
"DANC181 PPO"||`||""||`||"DANC181 PPO"||`||"Dance Repertory"||`||"PTHD"||`||"PO"||`||"PO"||`||"Dance Repertory. Same course as 180, but studio work and critical reviews only. Half-course. Also available as studio course for cumulative credit (181P)."
"DANC191  SC"||`||"50.0301"||`||"DANC191  SC"||`||"Senior Thesis in Dance"||`||"SDAN"||`||"SC"||`||"SC"||`||""
"DANC192  PO"||`||""||`||"DANC192  PO"||`||"Senior Project"||`||"PTHD"||`||"PO"||`||"PO"||`||"Senior Project. Performance: Creation of an original choreographic work for performance and writen thesis documenting theme, process, and execution of the work. Movement studies: Research project, preferably of an interdisciplinary nature, culminating in a written thesis."
"DANC193  SC"||`||"50.0301"||`||"DANC193  SC"||`||"Production Experience"||`||"SDAN"||`||"SC"||`||"SC"||`||"All dance majors are required to complete at least four different production/crew assignments on Scripps dance events. Each assignment must be a minimum of four hours work. Pass/Fail. Non-credit."
"DS  002  SC"||`||"27.0101"||`||"DS  002  SC"||`||"Intro to Data Science"||`||"SIDO"||`||"SC"||`||"SC"||`||"This course is the second part of a two-semester flipped-course introduction to computer programming and data science. Students will explore, using Python and other tools (e.g., SQL), the nuances of gathering, visualizing and analyzing data to drive informed decision-making. Students will be introduced to use various data manipulation/analysis and machine learning libraries (pandas, scikit learn, etc.) and statistical methods. They will also consider the ethical implications and limitations of creating models to deal with large amounts of data efficiently. As in the first course, students will work collaboratively on in-class projects dealing with real-world datasets.  Prerequisite: DS  001 (formerly Math 042) or equivalent (knowledge of Python). This course does not satisfy the Scripps math major or Scripps math GE, and will not satisfy requirements for computer science major or minor."
"DS  108  PZ"||`||""||`||"DS  108  PZ"||`||"Data & Justice Past and Future"||`||"ZID"||`||"PZ"||`||"PZ"||`||"Data and Justice: Past, Present, Future||``||||``||What is the relationship between data and justice? This course considers how the collection and analysis of data have created (and continue to create) systems of oppression. This course explores how data science has empowered (and can continue to empower) individuals and groups in building a more just society. ||``||"
"DS  180  CM"||`||"30.0601"||`||"DS  180  CM"||`||"Adv Projects in Data Science"||`||"MIDS"||`||"CM"||`||"CM"||`||"This course allows teams of students to wrestle with real-world problems in data science. Students will identify data sets to work with, evaluate the quality of these data sets, manipulate data, provide summary statistics, and conduct a preliminary analysis using these data sets. Corporations, non-profit agencies, or individual researchers will sponsor projects for teams of students to undertake over the course of a semester. Students will work in groups to produce data-driven analyses and sophisticated reports to satisfy the sponsors requirements. This course serves as the capstone experience for the Data Science sequence. Specific topics vary by instructor. Prerequisites: CSCI036  CM, Statistics, and at least two other Data Science courses.||``||"
"EA  010  PO"||`||""||`||"EA  010  PO"||`||"Intro to Environmental Analysis"||`||"PEVA"||`||"PO"||`||"PO"||`||"An EA Program introductory core course examines the history of environmental change, by critically examining climate change, biodiversity loss, trends in air and water resources. This course includes a broad range of disciplines, including the natural sciences, humanities, and social sciences. Using a multidisciplinary view of environmental problems, students will apply concepts of environmental justice and ecological sustainability and policy decision tools. Course is equivalent to EA  010  HM, EA 010 PZ, and EA  010  SC. "
"EA  010  PZ"||`||""||`||"EA  010  PZ"||`||"Intro to Environmental Analysis"||`||"ZEVA"||`||"PZ"||`||"PZ"||`||"This course, is required for the Environmental Studies major, is an interdisciplinary examination of some of the||``||major environmental issues of our time. This course explores aspects of societys relationship with environment using the humanities, social sciences and naturalsciences. Topics include: environmental ethics and philosophy; ecosystems, biodiversity, and endangered species; North/South environmental conflicts; air||``||pollution and acid rain; ozone depletion; climate change; biotechnology; and international environmental policy."
"EA  010  SC"||`||""||`||"EA  010  SC"||`||"Intro to Environmental Analysis"||`||"CEA"||`||"SC"||`||"SC"||`||"Introduction to Environmental Studies. (An EAP Introductory Core Course). Examines the history of environmental change over the past century, the environmental ramifications of economic and technological decisions, lifestyles and personal choice and the need to evaluate environmental arguments critically.Course pending faculty approval. "
"EA  020  PO"||`||""||`||"EA  020  PO"||`||"Nature, Culture and Society"||`||"PEVA"||`||"PO"||`||"PO"||`||"Nature, Culture and Society. (An EAP Introductory Core Course) This required class for all EA majors is especially designed for sophomores and juniors. It will employ case studies to help analyze some key contemporary environmental dilemmas. Topics will vary, but will draw on an interdisciplinary array of sources in the humanities and social sciences, including history, philosophy and literature; religion, art, politics and sociology."
"EA  021  CM"||`||""||`||"EA  021  CM"||`||"EnviroLab Asia: Research/Methods"||`||"CEA"||`||"CM"||`||"CM"||`||"This course examines the relationship between the environment and political, social, economic and cultural issues in East and Southeast Asia. In particular, it studies this relationship within the country being studied by EnviroLab Asia in the academic year. The course introduces students to a cross-disciplinary approach to study this relationship by exposing students to methodologies in humanities and social sciences as well as the history of country. The cross-disciplinary training will prepare students for a Clinic Trip at the end of the semester in which the students will travel to the country being studied to carry out research on the ground where they will apply their learned methodologies. Also listed as HIST160  CM.||``||"
