"externalId"||`||"classificationOfInstructionalProgramCode"||`||"courseNumber"||`||"courseTitle"||`||"departmentExternalId"||`||"institutionExternalId"||`||"facilityExternalId"||`||"description"
"HIST125  CM"||`||""||`||"HIST125  CM"||`||"Asian American Hist:1850-Present"||`||"MHIS"||`||"CM"||`||"CM"||`||"This survey course examines the history of Asian immigrant groups and their American-born descendants as they have settled and adjusted to life in the United States. We will explore issues such as the experience of immigration, daily life in urban ethnic enclaves, and racist campaigns against Asian immigrants. Throughout the course, we will ask how these issues relate to a larger history of American nation-building and diplomatic relations with Asia."
"HIST128  CM"||`||""||`||"HIST128  CM"||`||"LGBTQ History of the U.S."||`||"MHIS"||`||"CM"||`||"CM"||`||"This course explores the experiences of people in the United States whom we might today define as gay, lesbian, bisexual, transgender or queer. Drawing on recent scholarship, it analyzes those experiences in the context of American political, economic, social, legal, urban, and military history, with emphasis on the 20th century. Topics include changing categories of identity, the role of state policies and actions, the effects of wartime, Cold War persecution, the rise of gay and lesbian liberation movements, the impact of the AIDS epidemic, the emergence of queer theory, debates over military exclusion and same-sex marriage, and the significance of race, religion, class, gender, and region.||``||||``||"
"HIST132  CM"||`||""||`||"HIST132  CM"||`||"Genocide/Hum-Rights 20thC Europe"||`||"MHIS"||`||"CM"||`||"CM"||`||"During the twentieth century, the totality and modern features of the mass murder of civilians proved so alarming and unprecedented that by mid-century observers, led by Raphael Lemkin, developed a new concept for this historical phenomenon: genocide. This course will focus on case studies of genocide and genocide prevention in Europe. How do border changes, nation-state formation, and the collapse and rise of empires trigger ethnic cleansing and genocide as occurred in the Ottoman Empire, the Second World War, and more recently in the post-Soviet conflicts in the former Yugoslavia? Lectures and discussions will delve into specific topics, such as the role of racism, anti-Semitism and biopolitics, the psychological responses of victims, the inclusion of rape as a genocidal war crime, the response of bystanders, perpetrator motivation, and trends in post-genocidal societies such as trials, memorialization and compensation.||``||"
"HIST133  AF"||`||""||`||"HIST133  AF"||`||"Slavery & Freedom in New World"||`||"PHST"||`||"PO"||`||"PO"||`||"This is a survey course intended to cover the history of Africans and their descendants in the Americas from the epoch of the transatlantic Slave Trade until the end of the nineteenth century. The course is divided into two general sections: the slave epoch and emancipation (and its aftermath). (Africa, African Diaspora and Middle East; United States) Previously offered as HIST143  AF."
"HIST134  CM"||`||"54.0101"||`||"HIST134  CM"||`||"Dostoevskii's Russia"||`||"MHIS"||`||"CM"||`||"CM"||`||"This course is: (1) a study of Dostoevskii's life, his religious and ideological beliefs as articulated in major fictional and non-fictional works, his contributions to nineteenth-century debates about Russia's place in the world and its historical 'mission'; (2) The Russian social, religious and ideological context(s) in which Dostoevskii operated.  Satisfies the General Education requirement."
"HIST137  SC"||`||"54.0101"||`||"HIST137  SC"||`||"Eating/Drinking: Totalitarianism"||`||"SHIS"||`||"SC"||`||"SC"||`||"Eating and Drinking in the Time of Totalitarianism. Between the 1920s and 1950s, a number of Europe's fledgling democracies disintegrated||``||into totalitarian dictatorships. During the past thirty or so years, scholars of modern Europe have begun to question the degree to which these regimes really were ?totalitarian? in their expression of power. This seminar, therefore, is designed to explore the political and cultural histories of twentieth century Europe's totalitarian regimes, including Fascist Italy, Nazi Germany, Soviet Russia, and others via the analytical lenses of various types of foodstuffs and beverages. Ranging in topics from the production of geneticallymodified strains of wheat to the politics of women's labor and consumption (public/private responsibilities, shopping and cooking, resistance and non-compliance via eating and drinking, etc.) to, finally, the regulation and enjoyment of alcoholic beverages, we will explore these societies ?from above? and ?from below? by evaluating the degree to which everyday eating and drinking impacted both the construction of these notorious dictatorships and the on-the-ground realities of everyday, quotidian experience. 	"
"HIST138  PZ"||`||""||`||"HIST138  PZ"||`||"Hist and Sci of Innateness"||`||"ZHIS"||`||"PZ"||`||"PZ"||`||"[Also||``||Psyc 138] Human nature has long been invoked to understand and justify our||``||behaviors. After the advent of Darwinian evolution and Mendels gene theory,||``||however, the notion of instinct gained authority, reshaping categories like race||``||and nature. We will track that shift and examine its effects on political economy||``||and social policy."
"HIST142E CM"||`||""||`||"HIST142E CM"||`||"Cult & Pol in Europe: 1880-1918"||`||"MHIS"||`||"CM"||`||"CM"||`||"Explores the relationship between politics, culture, and social change in Western and Central Europe.  Units will focus on important cities including Vienna, Berlin,  Munich, Prague, Budapest, and Paris.  Topics include the rise of psychoanalysis, impressionism, and expressionism, conceptions, of decadence, cultural pessimism, and anxieties about changing gender roles.  Offered every other year.||``||"
"HIST143  SC"||`||"54.0101"||`||"HIST143  SC"||`||"Cuba/Bolivia/Vzla: Revolution"||`||"SHIS"||`||"SC"||`||"SC"||`||"We will explore how racial identities have shaped resistance in Bolivia, Cuba and Venezuela, and analyze the nature of new freedoms in these contemporary revolutions. "
"HIST146  PO"||`||""||`||"HIST146  PO"||`||"Persian Book of Kings: Shahnameh"||`||"PHST"||`||"PO"||`||"PO"||`||"The Persian epic of the Shahnameh: The Persian Book of Kings, composed by the poet Abu'l Qasim Firdawsi between the years 980 and 1010, tells the mythic story of ancient Iran from the time of creation to the Arab conquest of the seventh century.  In its pages are unforgettable tales of triumph and failure, heroism and betrayal, love and grief, and of encounters with martial heroes, mythical birds, and otherworldly demons.  As an epic it opens a window into the Persianate world, spanning Iran, India, and Central Asia, bringing its cultures into view.  This course covers the entirety of the epic in translation and explores the overarching themes running through it.  It further details the material culture and illustrated manuscript tradition of the Shahnameh and its reproduction in medieval and early modern Islamic courts where it endured as a princely manual on empire and kingship."
"HIST148  PO"||`||""||`||"HIST148  PO"||`||"British Empire Middle East"||`||"PHST"||`||"PO"||`||"PO"||`||"This course covers the eighteenth- to twentieth-century history of the British Empire in the diverse area commonly referred to as the Middle East: the Arabian peninsula, Egypt, Sudan (the Anglo-Egyptian Condominium) and portions of the former Ottoman Empire that fell under British mandate after World War One, namely Iraq, Palestine and Transjordan. It also places British interest in the Middle East in a broader global context, paying particular attention to intra-European imperial rivalries as well as to Britain's presence in the Eastern Mediterranean, Persia and India."
"HIST149  SC"||`||"54.0101"||`||"HIST149  SC"||`||"Themes/Methods African History"||`||"SHIS"||`||"SC"||`||"SC"||`||"Themes and History in African History. In this history seminar, we will examine methods, themes, concepts, and debates in African history. We will investigate early Black diasporic approaches to studying Africa's past, as well as the construction of Africa as a field?its professional foundations in both the Cold War and student protest. We will then explore works that draw on the range of methodologies used in writing African History: including archaeology, linguistics, oral history, ecology, anthropology, and area studies. Topics will span Africa's early past (the Sudanic empires of West Africa, Bantu migration, trans-Saharan trade); Atlantic and Indian Ocean slavery and the slave trade; race and racialization in African studies; twentieth-century transnational movements and anticolonial politics; and the ethics of speculation in post-colonial histories. Equipped with familiarity in both foundational and newly published works, students will be encouraged to think as historians across disciplines, to read academic texts for both argument and method, and to think expansively of what archives can be."
"HIST151  PZ"||`||""||`||"HIST151  PZ"||`||"Race & Medicine in U.S. History"||`||"ZHIS"||`||"PZ"||`||"PZ"||`||"Race and Medicine in U.S. History:||``||||``||Beginning with the establishment of plantation slavery and the process of expropriating Native American land in the colonial Americas, Anglo-American physicians have used theories of racial difference to interpret health in the Americas. In this course, students will trace the rise of scientific race concept and its dissemination in U.S. Medicine from the colonial period to the present. Finally, this course asks students to consider how everyday activists and physicians have challenged the use of race in medicine in diverse social movements in U.S. history."
"HIST154  PZ"||`||""||`||"HIST154  PZ"||`||"You Can't Teach That"||`||"ZHIS"||`||"PZ"||`||"PZ"||`||"You Can't Teach That: An Essay on an Attempt to Re-Establish ||``||Academic Freedom.||``||||``||This seminar examines academic freedom by probing limits on the||``||permissibility of speech, especially faculty speech, in US college ||``||classrooms during two eras: (i) the present and immediate past and (ii) ||``||the long twentieth century.  Along with examining several case studies ||``||and reading key texts that make the case for academic freedom, the ||``||course engages in the praxis of teaching important artistic, political, ||``||and scholarly works that push, or perhaps cross, the boundaries of ||``||permissibility for classroom teaching in our own time and place, ||``||including Joshua Cohen's 2021 novel, The Netenyahus, Radu Jude's ||``||2021 film, Bad Luck Banging or Loony Porn and one or more ||``||ethnographic texts concerned with social worlds in which normative ||``||behavior would lead to severe sanctions if it occurred here (on our ||``||campus) and now (in 2023).    "
"HIST157  CM"||`||""||`||"HIST157  CM"||`||"Gender & Sexuality in Latin Amer"||`||"MHIS"||`||"CM"||`||"CM"||`||"This course introduces students to the emerging historiography on gender and sexuality in Latin America. We examine changing gender roles and shifting constructions of masculinity, femininity and honor in Latin America with particular attention to issues of sexuality, sexual preference, sexual constraints, and sexual transgressions. Topics include the encounter between Indigenous peoples and Europeans, slavery, honor and whiteness during the independence era, prostitution, maternalism, patriarchy, queer studies, feminism, labor and class, nationalism, and dictatorships, social protest and transgendered studies. Readings include works on the colonial period and the 19th century, but most of the course will focus on these issues in the context of the 20th century.||``||"
"HIST160  CM"||`||""||`||"HIST160  CM"||`||"EnviroLab Asia:Research/Method"||`||"MHIS"||`||"CM"||`||"CM"||`||"This course examines the relationship between the environment and political, social, economic and cultural issues in East and Southeast Asia. In particular, it studies this relationship within the country being studied by EnviroLab Asia in the academic year. The course introduces students to a cross-disciplinary approach to study this relationship by exposing students to methodologies in humanities and social sciences as well as the history of country. The cross-disciplinary training will prepare students for a Clinic Trip at the end of the semester in which the students will travel to the country being studied to carry out research on the ground where they will apply their learned methodologies. Also listed as EA 021 CM.||``||"
"HIST166  CM"||`||""||`||"HIST166  CM"||`||"Murder & Mayhem Imperial China"||`||"MHIS"||`||"CM"||`||"CM"||`||"This course examines the intersection between law and society in imperial China. Focusing primarily on the Qing dynasty (1644-1911), we will read records of crimes and disputes as windows into the ideal and reality of everyday life. Topics studied include the social and cultural fabrics of imperial China (e.g. government, family, and beliefs); the Qing legal system (e.g. how crimes were defined, tried, and punished); and skills necessary for making arguments about the past (e.g. determining what a document can and cannot tell us about the society that produced it). The course assumes no prior knowledge of Chinese history."
"HIST166  PO"||`||""||`||"HIST166  PO"||`||"Hong Kong and Taiwan History"||`||"PHST"||`||"PO"||`||"PO"||`||"This course will cover the history of Hong Kong and Taiwan from the late 19th century to the present. Some of the themes it will explore include colonization and decolonization, cross-strait relations between Taiwan and China, the Cold War, and the contesting future imaginations of the region. The course focuses on the historiography of Hong Kong, Taiwan and its neighboring regions. We will also be looking at primary sources, such as personal papers, government archival documents, magazines and newspapers."
"HIST167  CM"||`||""||`||"HIST167  CM"||`||"Gender & History in South Asia"||`||"MHIS"||`||"CM"||`||"CM"||`||"This seminar looks at the way gender is constituted with a case study of South Asia (India, Pakistan, Nepal, Sri Lanka and Bangladesh).  We will use feminist approaches to discuss how 'women' and feminity, and 'men' and masculinity are produced.  After a quick survey of South Asian history to locate gender, we will look at three specific problems areas:  how the state and its legal system apportion power to women and men; how education works to produce different gender identities; and how in the arts the human body is differently used and interpreted, and experiences and emotions become gendered."
"HIST169  PZ"||`||""||`||"HIST169  PZ"||`||"Globaliz & Oceania: Hawai'i & Tn"||`||"ZHIS"||`||"PZ"||`||"PZ"||`||"Globalization and Oceania: Hawai'i and Tonga||``||||``||This comparative course explores the deep histories of Hawai'i and Tonga, beginning with their||``||stories of creation and closing with the annexation of these independent kingdoms by the U.S.||``||and British Empires at the end of the nineteenth century. Topics include: creation, voyaging,||``||gender, power, and the land."
"HIST170  CM"||`||"54.0101"||`||"HIST170  CM"||`||"Sex and Censorship in South Asia"||`||"MHIS"||`||"CM"||`||"CM"||`||"Restrictions on speech are a feature of democracies everywhere, from persecuting whistleblowers in the US to banning religious symbols in France to imposing restrictions on Twitter in Turkey. What sets the South Asian experience apart? This course will interrogate how a nexus of concerns over power, religion, and sex, originating in the colonial experience, has shaped the particular dynamics of censorship in South Asia. By examining the regionas long history of banning and prohibition, we will gain insight into how censorship has moulded South Asian cultural and political life. This course welcomes students interested in gender and sexuality studies, cinema and media studies, literature, history, politics, human rights, anthropology, and modern South Asian history and culture, as well as students interested in the past and present of censorship and democracy in the non-West."
"HIST174  CM"||`||"54.0101"||`||"HIST174  CM"||`||"Design Activism"||`||"MHIS"||`||"CM"||`||"CM"||`||"This seminar studies the relationship between the world of design and social transformations from the early twentieth century to the present. In particular, it examines the history of modern design movements in the non-West, especially Latin America, Asia and the Middle East, from the early twentieth century to the present, and how these movements have negotiated processes of political economy to produce new forms of agency, identity, community and social exchange for the transformation of everyday life and ultimately social renewal.||``||"
"HIST174  PO"||`||""||`||"HIST174  PO"||`||"Rise &  Fall of The Soviet Union"||`||"PHST"||`||"PO"||`||"PO"||`||"This course explores the rise and fall of the Soviet Union, from its birth amid the Great War to its collapse in 1991 and ongoing dissolution in the twenty-first century. We examine the political and social processes by which a multi-ethnic and multi-confessional empire transformed into the world's first socialist society. Our focuses include the creation of a revolutionary dictatorship, the evolution of Soviet ideology, everyday life under socialism, industrialization and agricultural collectivization, geopolitical competition, reform, dissent, and nationalism. We devote attention to patterns and variations across the Soviet space, from the Baltic Sea to Siberia and Central Asia."
"HIST178  PZ"||`||""||`||"HIST178  PZ"||`||"Queer & Feminst Histories of EME"||`||"ZHIS"||`||"PZ"||`||"PZ"||`||"Queer and Feminist Histories of Early Modern Europe:||``||||``||This course explores the performance of gendered and sexual identities in early modern Europe,||``||to understand the parameters of queer, trans, and feminist experience and ideas from 1400 to||``||1700. Focusing on narratives produced by people living in this era, as well as recent queer and||``||feminist historical scholarship, this course engages with subject matter (including early modern||``||norms of violence and sexuality) that can be challenging for twenty-first-century readers. "
"HIST179  CM"||`||"54.0101"||`||"HIST179  CM"||`||"Researching the Holocaust"||`||"MHIS"||`||"CM"||`||"CM"||`||"Exploration of research and reflection on the cutting-edge of current issues and debates surrounding Nazi Germany's attempt to annihilate the Jews. In a seminar-style inquiry designed for students who want to take their previous Holocaust studies to a more advanced level, attention focuses on film and internet resources, as well as on recent books and articles.||``||"
"HIST179  PO"||`||""||`||"HIST179  PO"||`||"Histories of Black Europe"||`||"PHST"||`||"PO"||`||"PO"||`||"This course explores the history of the African diaspora in Europe since the fifteenth century. From the arrival of elite and enslaved Africans in the early modern period to the migration of students and workers in the colonial and post-colonial eras, Black people have established a longstanding presence in Europe. Our course focuses on the lived experiences of Black Europeans and the ways they shaped Europe's political, social, and cultural history as they confronted racial discrimination and fought for liberation and citizenship. We examine the evolution of racial thinking and changing meanings of Blackness, Black women's and worker's movements, and Black internationalism, paying attention to the diversity of Black experiences across Europe."
"HIST180  PO"||`||""||`||"HIST180  PO"||`||"Decolonization European Empires"||`||"PHST"||`||"PO"||`||"PO"||`||"At the start of World War II in 1939, approximately one-third of the world's population lived under European colonial rule. By the end of the twentieth century, that number had dropped to less than one percent. This course examines the ending of European empires in Asia, Africa, the Middle East, and the Caribbean. Themes addressed include theories of imperialism and decolonization; anti-colonial nationalist and internationalist movements; the roles of violent and non-violent resistance; European domestic politics and international agreements; cultural imperialism; post-colonial immigration; the legacy of empire and decolonization; and the persistence of imperialism in the twenty-first century."
"HIST180  SC"||`||"54.0101"||`||"HIST180  SC"||`||"Proseminar: What is History?"||`||"SHIS"||`||"SC"||`||"SC"||`||"References to 'history' abound in the context of America's current political||``||crisis. But why and how is history especially relevant now? Is its lesson primarily instructive, to teach us that the past either repeats itself or is constituted by unique events? Does history provide critical distance to help us reflect on the present maelstrom of political rancor and division? Or might its uses even be emotional or psychological, offering comfort and shelter from a harsh contemporary reality? This course will consider these questions and others through a reading of historical monographs dealing with a variety of topics, time periods, and places."
"HIST183  CM"||`||""||`||"HIST183  CM"||`||"The Fall of Rome: End of Empire"||`||"MHIS"||`||"CM"||`||"CM"||`||"Political corruption, economic failure, barbarian invasion, religious rupture and even the plague have all been offered as explanations for the end of the Roman Empire. But do we really understand how and when a political system and culture that enjoyed such remarkable longevity finally came to an end? This course will examine the often widely divergent interpretations of material and documentary evidence offered by historians, classicists and archaeologists. Political, economic, military, religious, social and environmental factors will receive careful attention.||``||"
"HIST187  PZ"||`||""||`||"HIST187  PZ"||`||"Politicl Econ of Global Football"||`||"ZHIS"||`||"PZ"||`||"PZ"||`||"History and Political Economy of World Soccer: ||``||||``||Is anything more global than football? Can any cultural practice match its contemporary reach? In this course, students will cover the global history of football from the mid-nineteenth century to the present, understanding the game as an economic, cultural and political phenomenon. Students will have the chance to look at the history and sociology of football on every continent, the mens and the womens game, as well fan cultures, the operation of intentional institutions and mega events."
"HIST189G PO"||`||""||`||"HIST189G PO"||`||"History of the Sahara"||`||"PHST"||`||"PO"||`||"PO"||`||"The Sahara Desert is one of the world's most intriguing and least understood regions. The Sahara conjures up images of vast dunes, lush oases, and mysterious nomads. It makes up one-third of the African continent by area, and is comparable in size to the United States. This course demystifies the Sahara by considering its history from the deep past to the present, and by historicizing contemporary events in this increasingly geopoliticallyimportant area. The course familiarizes students with interdisciplinary methods through the reading of a wide array of primary and secondary sources from historical, anthropological, environmental studies, art historical, and other approaches. Letter grade only."
"HIST190  CM"||`||""||`||"HIST190  CM"||`||"Race & American Cities"||`||"MHIS"||`||"CM"||`||"CM"||`||"This upper-level research seminar will examine the relationship between urban development and race from the colonial era to the present. We will analyze the historical forces and institutions that have created forms of racial segregation and economic inequality and explore the role of cities as a site of racial conflict, interaction, collaboration and identity formation. Surveying a wide range of places, groups and issues, the course will provide a way to better understand the economics, politics and social life of American cities in the past and the present and to think spatially and geographically about historical continuity and change. Satisfies the Advanced Seminar requirement in the history major.||``||||``||||``||"
"HIST191  PO"||`||""||`||"HIST191  PO"||`||"Senior Thesis"||`||"PHST"||`||"PO"||`||"PO"||`||"An independent research and writing project culminating in a substantial, original historical work. Directed by one faculty member, chosen by the student (in all but exceptional cases) from the History Department faculty. The thesis may incorporate the Senior Paper from HIST190 PO - Senior Seminar. Each thesis read by one additional reader. Students present their theses orally. Letter grade only. Prerequisites: HIST 190 PO and completion of at least three courses in the field in which students intend to write their theses."
"HIST191  SC"||`||"54.0101"||`||"HIST191  SC"||`||"Senior Thesis in History"||`||"SHIS"||`||"SC"||`||"SC"||`||"Fall enrollment for a one-semester thesis, or a two-semester thesis. Enroll for HIST192 SC in the spring for a two-semester thesis.||``||"
"HIST192  PO"||`||""||`||"HIST192  PO"||`||"Senior Essay"||`||"PHST"||`||"PO"||`||"PO"||`||"An independent writing project culminating in a substantial essay that is based on an analysis of primary evidence; is a historiography; or is driven by an analysis and presentation of secondary literature. The essay may draw upon work completed in the History 190 Senior Seminar. Directed by one faculty member, chosen by the student (in all but exceptional cases) from the History Department; and read by one additional faculty reader of the student's choosing. Students present their essays orally. Letter grade only. Prerequisites: HIST 190 PO."
